千万别来淄博吃烧烤！我怕你尝过忘不了！,491000,1375
小拉泽测评淄博烧烤！“神之舌”体验烧烤搭配花式酱料！,241000,599
淄博烧烤火了 小饼裹串夹小葱真就那么上头？,9325,17
老外专程搭高铁去淄博吃烧烤，尝一口后大赞：国王才能享受的食物,56000,15
给她馋完了！非得吃淄博烧烤！,264000,379
外国小哥到山东潍坊吃淄博烧烤，坐街头边撸串边豪横解说：特好吃。,30000,14
家人们谁懂啊！淄博烧烤让峰哥好吃到翘jiojio！,34000,9
淄博烧烤：小饼卷肉 快乐没够儿！,172000, 219
淄博烧烤真的太好吃了！找到一家宝藏地方人还不用排队！, 42000,50
终于和闺蜜打卡了淄博烧烤！嘎嘎香~,114000,117
裹满烤肉的淄博小饼蘸上热腾腾的番茄浓汤，一口下去都不想走了,162000,188
淄博旅游三天两夜vlog，淄博美食我真的爱!!!,6831,6
带老挝媳妇去山东淄博吃烧烤是什么体验？满满的热情好客，好吃的,25000,139
愤怒的小鸟创始人吃上淄博烧烤 用方言点赞“淄博烧烤好吃,647000,62
来淄博第一顿必须吃烧烤,95000,59
"看这架势，高低得去感受把正宗的淄博烧烤了！"，呼吁去体验正宗的淄博烧烤。,301000,61
“淄博烧烤”的养生，高级养生,344,0
奔赴三百多公里，就为体验一下淄博烧烤。小饼小葱小火炉，仪式感满满，确实很有趣！,43000,67
带韩国女友第一次吃淄博烧烤，好吃到炸裂怎么以前没发现呢,29000,159
没想到征服老外的竟是“淄博烧烤”，人均10美元敞开了吃！,480,0
山东淄博人山人海吃烧烤火到国外，韩国泰国欧美纷纷称赞：烧烤文化征服世界。,51000,76
不去淄博排队了，零门槛在家吃正宗淄博烧烤！,8390,81
当“淄博烧烤”遇上“台湾啤酒”，这人间烟火简直无敌了！,14000,88
隋卞一探淄博烧烤大横评，特厨一条视频告诉你人气最高的三家店，到底哪家最好吃！,903000,1938
同事五一想去淄博吃烧烤，工厂放假了你怎么安排,388,1
老外看完《人生一串3》，直奔临淄吃了顿地道的淄博烧烤！,1606000,2947
淄博烧烤真的太太太香了！！属于是体验了三种吃法,11000,28